company,type,holding,estimated_value_usd_million,date,notes
Strategy (MicroStrategy),Bitcoin Treasury,843775 BTC,53780,2026-07,Not AI-token specific; largest corporate crypto holder for comparison
Grayscale Decentralized AI Fund,Investment Fund,TAO NEAR RNDR FIL GRT basket,NA,2025-07,First dedicated AI-token investment fund for accredited investors
AI Financial Corporation,Digital Asset Treasury,3321690994 WLFI tokens,180,2026-06,WLFI tokens available as collateral for loans
VanEck,Asset Manager,Crypto AI research and ETF proposals,NA,2024,Published projection that AI infrastructure tokens could generate $2B revenue by 2030
a16z,Venture Capital,Multiple AI-crypto investments,4900,2025,VC investment in AI-crypto sector estimated at $4.9B across all firms in 2025
Tesla,Bitcoin Treasury,9720 BTC,610,2025-Q4,Digital asset holdings for comparison
Block (Square),Bitcoin Treasury,8027 BTC,503,2025-Q4,Digital asset holdings for comparison
S&P 500 Digital Asset Disclosure,Corporate Disclosure,47 of 500 companies,NA,2025,Approximately 9% of S&P 500 mentioned digital assets in 10-K filings
